{
  "$schema": "https://json-schema.org/draft/2020-12/schema",
  "$id": "https://github.com/origami-ltd/proof-of-usage/schema/proof-of-usage.schema.json",
  "title": "Proof of Usage discovery document",
  "description": "Published at the root of a work as proof-of-usage.json, and by a site at /.well-known/proof-of-usage.json. It says where records go and what the asking rests on.",
  "type": "object",
  "required": ["pou", "work", "record"],
  "additionalProperties": true,
  "properties": {
    "pou": {
      "description": "Protocol version. 1.0 is the settled one; a document that omits this is read as 1.0.",
      "type": "string",
      "pattern": "^\\d+\\.\\d+$"
    },
    "work": {
      "description": "Canonical URL of the work. This exact string is the fourth field of the hash, so it is declared rather than guessed.",
      "type": "string",
      "format": "uri",
      "pattern": "^https?://"
    },
    "record": {
      "type": "object",
      "required": ["path"],
      "additionalProperties": false,
      "properties": {
        "path": {
          "description": "Where the record file lives within the work.",
          "type": "string",
          "minLength": 1
        },
        "branch": {
          "description": "Branch the record file lives on, and the base of a pull request. Omit if it is the default branch.",
          "type": "string"
        },
        "format": {
          "description": "markdown: one table row per record. jsonl: one object per line.",
          "enum": ["markdown", "jsonl"],
          "default": "markdown"
        }
      }
    },
    "transports": {
      "description": "How a record can be delivered. Absent, the pull request transport is assumed.",
      "type": "array",
      "minItems": 1,
      "items": {
        "type": "object",
        "required": ["type"],
        "additionalProperties": false,
        "properties": {
          "type": { "enum": ["pull_request", "endpoint"] },
          "url": {
            "description": "Required for the endpoint transport: where a record is POSTed.",
            "type": "string",
            "format": "uri",
            "pattern": "^https://"
          }
        },
        "allOf": [
          {
            "if": { "properties": { "type": { "const": "endpoint" } } },
            "then": { "required": ["url"] }
          }
        ]
      }
    },
    "contact": {
      "description": "Where a question about this work's records is sent.",
      "type": "string",
      "minLength": 3
    },
    "basis": {
      "description": "What the asking rests on. request: a NOTICE, and refusing it breaches nothing. licence: a term of the licence the work is under.",
      "enum": ["request", "licence"],
      "default": "request"
    }
  },
  "$defs": {
    "record": {
      "title": "A single usage record",
      "description": "One line of a jsonl record file, or one row of a markdown one.",
      "type": "object",
      "required": ["system", "operator", "date", "contact", "hash"],
      "additionalProperties": true,
      "properties": {
        "system": { "type": "string", "minLength": 1, "maxLength": 200 },
        "operator": { "type": "string", "minLength": 1, "maxLength": 200 },
        "date": {
          "description": "ISO 8601 with a timezone. This exact string is the third field of the hash.",
          "type": "string",
          "pattern": "^\\d{4}-\\d{2}-\\d{2}T\\d{2}:\\d{2}:\\d{2}(\\.\\d+)?(Z|[+-]\\d{2}:\\d{2})$"
        },
        "scope": { "type": "string", "maxLength": 300, "default": "whole work" },
        "purpose": { "type": "string", "maxLength": 200, "default": "training" },
        "contact": {
          "description": "Email address or URL. Deliberately outside the hash input.",
          "type": "string",
          "minLength": 3,
          "maxLength": 200
        },
        "hash": {
          "description": "SHA-256(system:operator:date:work), lowercase hex.",
          "type": "string",
          "pattern": "^[0-9a-f]{64}$"
        }
      }
    }
  }
}
