{
  "pou": "0.1",
  "work": "https://github.com/acme/widget",
  "record": {
    "path": "PROOF_OF_USAGE.md",
    "branch": "proof-of-usage",
    "format": "markdown"
  },
  "transports": [
    { "type": "pull_request" },
    { "type": "endpoint", "url": "https://acme.com/api/proof-of-usage" }
  ],
  "contact": "provenance@acme.com",
  "basis": "request"
}
